{
  "outcome": "route",
  "conflict_class": "soft_conflict",
  "review_required": false,
  "route_to": "parent_loop",
  "classified_domain": "engineering",
  "classified_scope": "moderate",
  "rationale": "Scaffold fallback routes unresolved policy decisions to the parent loop.",
  "matched_rule_refs": [],
  "engine_version": "0.1.0"
}
